# Příklady a zápisky z hodin PRG třídy P2A v roce 2025/2026

* [Cvičení 4.9.2025](/cv-2025-09-04) + [pokyny](/cv-2025-09-04/README.md)
* [Teorie 11.9.2025](/t-2025-09-11)
* [Teorie 18.9.2025](/t-2025-09-18)
* [Teorie 2.10.2025](/t-2025-10-02)
* [Teorie 9.10.2025](/t-2025-10-09)
* [Teorie 6.11.2025](/t-2025-11-06)
* [Teorie 20.11.2025](/t-2025-11-20) - objekty
* [Teorie 04.12.2025](/t-2025-12-04) - třídy, objektové vlastnosti
* [Teorie 11.12.2025](/t-2025-12-11) - abstraktní třídy, rozhraní, statické členy
* [Teorie 08.01.2026](/t-2026-01-08) - polymorfismus
* [Teorie 12.02.2026](/t-2026-02-12) - datum a čas

````
npm create @pslib/ts-console@latest moje-app
````